{
  "$schema": "../../protocol-schemas/capability-manifest.v1.schema.json",
  "protocol": "agent-slayer.capability",
  "version": 1,
  "id": "catch-up",
  "title": "Check-in catch-up",
  "summary": "Generate questions for selected journal dates, upcoming event planning, and past-event follow-up. Ask one at a time and retain the exact selection, source-linked resolution, comments and deferral.",
  "aliases": [
    "catch me up",
    "catch up on the day",
    "check-in",
    "check in",
    "complete logs",
    "plan ahead",
    "daily review",
    "nag me",
    "hold me accountable",
    "unresolved",
    "get my life in order",
    "keep going"
  ],
  "readOnlyTools": [
    "catch_up_list"
  ],
  "dependentTools": [
    "calendar_event_update",
    "calendar_event_occurrence_update",
    "journal_add",
    "tracker_list",
    "tracker_asking_schedule_set",
    "contact_lookup_batch"
  ],
  "resources": [
    {
      "id": "catch_up.question",
      "kind": "object",
      "management": "user",
      "operations": {
        "create": { "tool": "catch_up_refresh", "batch": { "mode": "collection" }, "note": "Generation reconciles a bounded selected source scope rather than accepting model-authored question rows." },
        "read": { "tool": "catch_up_list", "batch": { "mode": "collection" } },
        "update": { "tool": "catch_up_question_update", "batch": { "mode": "singleton", "reason": "One response changes one source-linked question using its optimistic version." } },
        "delete": { "unavailable": "unsupported", "reason": "Generated questions are reconciled with their source and retained as resolved or deferred workflow history rather than manually deleted." }
      }
    }
  ],
  "guidance": "guidance.md"
}
