{
  "$schema": "../../protocol-schemas/capability-manifest.v1.schema.json",
  "protocol": "agent-slayer.capability",
  "version": 1,
  "id": "todos",
  "title": "To-dos",
  "summary": "Read, count, compare, and manage non-temporal personal to-dos and their named groups, including optional contact connections and links to content-library items. Calendar events own schedules and deadlines and may link to multiple to-dos.",
  "aliases": [
    "todo",
    "to-do",
    "task",
    "reminder",
    "chore",
    "task content",
    "watch job",
    "watch jobs",
    "todo group",
    "rename todo group",
    "delete todo group"
  ],
  "readOnlyTools": [
    "todo_group_list",
    "todo_list"
  ],
  "dependentTools": [
    "video_content_list"
  ],
  "guidance": "guidance.md"
}
