{
  "$schema": "../../protocol-schemas/capability-manifest.v1.schema.json",
  "protocol": "agent-slayer.capability",
  "version": 1,
  "id": "journal",
  "title": "Personal journal",
  "summary": "Create and manage native journal trackers and groups, and read, record, and correct their entries.",
  "aliases": [
    "journal",
    "tracker",
    "weight",
    "mood",
    "symptom",
    "workout",
    "sleep",
    "journal group",
    "rename journal group"
  ],
  "attachmentHints": [
    {
      "extensions": [
        ".csv"
      ],
      "mimeIncludes": [
        "csv"
      ],
      "headerTerms": [
        "tracker",
        "occurred_at",
        "number_value",
        "content_text",
        "unit",
        "tracker_unit"
      ]
    }
  ],
  "readOnlyTools": [
    "journal_list",
    "tracker_list"
  ],
  "guidance": "guidance.md"
}
