{
  "$schema": "../../protocol-schemas/capability-manifest.v1.schema.json",
  "protocol": "agent-slayer.capability",
  "version": 1,
  "id": "interaction-guides",
  "title": "Briefings",
  "summary": "Build and conduct resumable, agent-led briefings made of ordered exchanges and openings.",
  "aliases": [
    "briefing",
    "exchange",
    "opening",
    "interaction guide",
    "guided interaction",
    "structured conversation",
    "structured interaction"
  ],
  "readOnlyTools": [
    "interaction_guide_list",
    "interaction_guide_get"
  ],
  "guidance": "guidance.md"
}
