{
  "$schema": "../../protocol-schemas/capability-manifest.v1.schema.json",
  "protocol": "agent-slayer.capability",
  "version": 1,
  "id": "daily-paper",
  "title": "Printable daily paper",
  "summary": "Generate a durable printable PDF with a proportional daily timeline, available local weather, the authoritative calendar, linked to-dos, pinned groups, and scheduled trackers.",
  "aliases": [
    "daily paper",
    "daily sheet",
    "print my day",
    "print today",
    "printable calendar",
    "daily pdf"
  ],
  "guidance": "guidance.md"
}
