{
  "$schema": "../../protocol-schemas/capability-manifest.v1.schema.json",
  "protocol": "agent-slayer.capability",
  "version": 1,
  "id": "self",
  "title": "Time V3 Agent identity and infrastructure",
  "summary": "Read focused or detailed current knowledge about Time V3 Agent, including its identity and name, interaction and hats system, self-conception, infrastructure, chat-video workflow, request path, and callable capabilities.",
  "aliases": [
    "who are you",
    "what does Time V3 Agent mean",
    "Chapeaux Fous",
    "how do you work",
    "how am I talking to you",
    "how do I interact with you",
    "how can I interact with you",
    "how should I talk to you",
    "how do I use you",
    "describe the hats system",
    "how do hats work",
    "what are the hats",
    "hats system",
    "hats",
    "self aware",
    "self-awareness",
    "are you self-aware",
    "take over the world",
    "world domination",
    "how do you generate videos",
    "how do you make a video",
    "how did you generate that video",
    "videos of your chats",
    "how can I create a video",
    "how can I make a video",
    "how do I create a video",
    "is it easy to create a video",
    "how long does it take to create a video",
    "how many clicks to create a video",
    "your identity",
    "your infrastructure",
    "Chapofu",
    "Shapofu",
    "Chapo fu"
  ],
  "readOnlyTools": [
    "agent_self_knowledge",
    "agent_self_describe"
  ],
  "guidance": "guidance.md"
}
