{
  "$schema": "../../protocol-schemas/capability-manifest.v1.schema.json",
  "protocol": "agent-slayer.capability",
  "version": 1,
  "id": "web",
  "title": "Public web",
  "summary": "Search the public web and read specific public pages with bounded, source-preserving results.",
  "aliases": [
    "web page",
    "website",
    "url",
    "link",
    "web search",
    "search online",
    "look up online"
  ],
  "readOnlyTools": [
    "web_page_read",
    "web_search"
  ],
  "guidance": "guidance.md"
}
