{
  "$schema": "../../protocol-schemas/capability-manifest.v1.schema.json",
  "protocol": "agent-slayer.capability",
  "version": 1,
  "id": "video",
  "title": "Video scripts and productions",
  "summary": "Create, read, update, and rename content-library groups and items, create grounded scripts and Agent-interface MP4 productions, or add a completed generated video to a sequence.",
  "aliases": [
    "video",
    "video script",
    "script",
    "add video to content",
    "content sequence",
    "content library",
    "video series",
    "external videos",
    "add content items",
    "update content items",
    "edit content library",
    "promo library",
    "rename content group"
  ],
  "readOnlyTools": [
    "video_script_get",
    "video_content_list"
  ],
  "guidance": "guidance.md"
}
