{
  "$schema": "../../protocol-schemas/capability-manifest.v1.schema.json",
  "protocol": "agent-slayer.capability",
  "version": 1,
  "id": "search",
  "title": "Global search",
  "summary": "Search across native domains and preserve exact object or relationship sets discovered during the request.",
  "aliases": [
    "global search",
    "search everywhere"
  ],
  "readOnlyTools": [
    "global_search"
  ],
  "guidance": "guidance.md"
}
